Sheet: BOM
B2: Project : | C2: MM1_Writer | F2: R1
B4: Author : Guillaume Guillet | E4: Revision 1 | F4: Licensed under CERN-OHL-W v2 or later
A6: Type | B6: Value | C6: Q | D6: References | E6: Package | F6: Manufacturer | G6: Store | H6: Store ID | I6: Unit price* | J6: Price
A7: C | B7: 10nF | C7: 3 | D7: C2, C3, C7 | E7: C_0805_2012Metric | F7: KEMET | G7: Mouser | H7: 80-C0805C103J5R | I7: 0.092 | J7: of:=[.I7]*[.C7] -> 0.276
B8: 1uF | C8: 2 | D8: C4, C6 | E8: C_0805_2012Metric | F8: KEMET | G8: Mouser | H8: 80-C0805C105K4RAC | I8: 0.092 | J8: of:=[.I8]*[.C8] -> 0.184
B9: 100nF | C9: 5 | D9: C1, C5, C8 to C10 | E9: C_0805_2012Metric | F9: KEMET | G9: Mouser | H9: 80-C0805C104M3R | I9: 0.092 | J9: of:=[.I9]*[.C9] -> 0.46
A10: U | B10: C8051F385-GQ | C10: 1 | D10: U1 | E10: LQFP-32_7x7mm_P0.8mm | F10: Silicon Labs | G10: Mouser | H10: 634-C8051F385-GQ | I10: 2.52 | J10: of:=[.I10]*[.C10] -> 2.52
B11: 74AHC595 | C11: 3 | D11: U2 to U4 | E11: SOIC-16_3.9x9.9mm_P1.27mm | F11: Texas Instruments | G11: Mouser | H11: 595-SN74AHC595DR | I11: 0.485 | J11: of:=[.I11]*[.C11] -> 1.455
A12: J | B12: Header10p | C12: 1 | D12: J4 | E12: Header_10p_2.54 | F12: Wurth Electronics | G12: Mouser | H12: 710-61201021621 | I12: 0.411 | J12: of:=[.I12]*[.C12] -> 0.411
B13: 5530843-2 | C13: 1 | D13: J3 | E13: TE_5530843-2 | F13: TE connectivity | G13: Mouser | H13: 571-5530843-2 | I13: 2.33 | J13: of:=[.I13]*[.C13] -> 2.33
B14: USB_B | C14: 1 | D14: J1 | E14: USB_B_OST_USB-B1HSxx_Horizontal | F14: Amphenol FCI | G14: Mouser | H14: 649-61729-0010BLF | I14: 0.896 | J14: of:=[.I14]*[.C14] -> 0.896
B15: PinSocket_1x04 | C15: 1 | D15: J2 | E15: PinSocket_1x04_P2.54mm_Horizontal | F15: Preci-dip | G15: Mouser | H15: 437-8018700420001101 | I15: 0.585 | J15: of:=[.I15]*[.C15] -> 0.585
B16: PinHeader_1x03 | C16: 1 | D16: J5 | E16: PinHeader_1x03_P2.54mm_Horizontal | F16: Molex | G16: Mouser | H16: 538-22-28-8033 | I16: 0.247 | J16: of:=[.I16]*[.C16] -> 0.247
A17: - | B17: PCB | C17: 1 | D17: - | E17: - | F17: G.Guillet | G17: - | J17: of:=[.I17]*[.C17] -> 0
H19: Total price : | J19: of:=SUM([.J7:.J17]) -> 9.364
H20: *Depend of the quantity | I20: Price is in CHF